{
  "aois": [
    {
      "event_ids": [
        "mae_sai_2024"
      ],
      "geometry": {
        "coordinates": [
          [
            [
              99.8384,
              20.3705
            ],
            [
              99.9441,
              20.3705
            ],
            [
              99.9441,
              20.4563
            ],
            [
              99.8384,
              20.4563
            ],
            [
              99.8384,
              20.3705
            ]
          ]
        ],
        "type": "Polygon"
      },
      "id": "aoi-01_mae_sai_core",
      "name": "Mae Sai core",
      "name_th": "แม่สาย พื้นที่หลัก",
      "sha256": "e4f09010f75328d02260d4915ff6fc85356854397b85260259672879a7192734"
    },
    {
      "event_ids": [
        "mae_sai_2024"
      ],
      "geometry": {
        "coordinates": [
          [
            [
              99.8107,
              20.2577
            ],
            [
              100.0368,
              20.2577
            ],
            [
              100.0368,
              20.4651
            ],
            [
              99.8107,
              20.4651
            ],
            [
              99.8107,
              20.2577
            ]
          ]
        ],
        "type": "Polygon"
      },
      "id": "aoi-02_mae_sai_district",
      "name": "Mae Sai district",
      "name_th": "อำเภอแม่สาย",
      "sha256": "99ac323314dc0c0a0930af9240368cb2ec5fa9c3edbb998c1d885816df4b3319"
    },
    {
      "event_ids": [
        "hat_yai_2025"
      ],
      "geometry": {
        "coordinates": [
          [
            [
              100.43,
              6.965
            ],
            [
              100.52,
              6.965
            ],
            [
              100.52,
              7.055
            ],
            [
              100.43,
              7.055
            ],
            [
              100.43,
              6.965
            ]
          ]
        ],
        "type": "Polygon"
      },
      "id": "aoi-03_hat_yai_core",
      "name": "Hat Yai core",
      "name_th": "หาดใหญ่ พื้นที่หลัก",
      "sha256": "8ca938deddb527ddb9e6a6c54767e771985e5696d353de5ff9f144be056f61de"
    },
    {
      "event_ids": [
        "hat_yai_2025"
      ],
      "geometry": {
        "coordinates": [
          [
            [
              100.38,
              6.9
            ],
            [
              100.58,
              6.9
            ],
            [
              100.58,
              7.12
            ],
            [
              100.38,
              7.12
            ],
            [
              100.38,
              6.9
            ]
          ]
        ],
        "type": "Polygon"
      },
      "id": "aoi-04_hat_yai_basin",
      "name": "Hat Yai basin",
      "name_th": "ลุ่มน้ำหาดใหญ่",
      "sha256": "3dca778114bee73436db7fbd5e118869c08ae8f830faa347d5ab69f62d352123"
    },
    {
      "event_ids": [
        "chao_phraya_2024",
        "chao_phraya_2025"
      ],
      "geometry": {
        "coordinates": [
          [
            [
              100.4,
              14.25
            ],
            [
              100.52,
              14.25
            ],
            [
              100.52,
              14.37
            ],
            [
              100.4,
              14.37
            ],
            [
              100.4,
              14.25
            ]
          ]
        ],
        "type": "Polygon"
      },
      "id": "aoi-05_chao_phraya_bang_ban_sena",
      "name": "Bang Ban / Sena",
      "name_th": "บางบาล / เสนา",
      "sha256": "b548f3e30c88ec0ec5492f5cd4f8dfbd8e87cdcaa3047f5fb0b928ba4c959fcc"
    },
    {
      "event_ids": [
        "chao_phraya_2024",
        "chao_phraya_2025"
      ],
      "geometry": {
        "coordinates": [
          [
            [
              100.6,
              13.98
            ],
            [
              100.72,
              13.98
            ],
            [
              100.72,
              14.08
            ],
            [
              100.6,
              14.08
            ],
            [
              100.6,
              13.98
            ]
          ]
        ],
        "type": "Polygon"
      },
      "id": "aoi-06_chao_phraya_rangsit",
      "name": "Rangsit",
      "name_th": "รังสิต",
      "sha256": "0a7d32aab4a94cc88260071312b7f346bfc05914600e33b0df713e57f3f2dee3"
    }
  ],
  "datasets": [
    {
      "id": "dataset-01",
      "limitations": [
        "October 12/22 temporal conflict is unresolved.",
        "No dates for individual patches; September-only extent cannot be recovered.",
        "Outside the analysis footprint is unobserved, not dry.",
        "Source confidence codes are not calibrated percentages."
      ],
      "rights": {
        "attribution": [
          "UNOSAT / GISTDA"
        ],
        "license": "CC BY-SA; version unresolved",
        "public_derivatives": false,
        "status": "local_context_public_derivatives_unresolved"
      },
      "role": "historical_context",
      "source_urls": [
        "https://data.humdata.org/dataset/water-extents-from-1-aug-2024-to-22-october-2024-over-chiang-rai-province",
        "https://unosat.org/static/unosat_filesystem/4009/FL20240912THA_GDB.zip"
      ],
      "temporal": {
        "end": "2024-10-22",
        "kind": "conflicting_cumulative_interval",
        "label": "1 August–22 October 2024; layer name ends 12 October",
        "start": "2024-08-01"
      },
      "title": "Mae Sai - UNOSAT/GISTDA accumulated flood extent and analysis footprint"
    },
    {
      "id": "dataset-02",
      "limitations": [
        "An October water observation cannot validate September flood accuracy.",
        "Provider source-area fields are not AOI-clipped areas."
      ],
      "rights": {
        "attribution": [
          "UNOSAT / GISTDA"
        ],
        "license": "CC BY-SA; version unresolved",
        "public_derivatives": false,
        "status": "local_context_public_derivatives_unresolved"
      },
      "role": "historical_context",
      "source_urls": [
        "https://data.humdata.org/dataset/water-extents-from-1-aug-2024-to-22-october-2024-over-chiang-rai-province",
        "https://unosat.org/static/unosat_filesystem/4009/FL20240912THA_GDB.zip"
      ],
      "temporal": {
        "end": "2024-10-22",
        "kind": "observation",
        "label": "22 October 2024; later observation, not September",
        "start": "2024-10-22"
      },
      "title": "Mae Sai - UNOSAT/GISTDA single-date flood extent"
    },
    {
      "id": "dataset-03",
      "limitations": [
        "Missing readings remain visible; maximum observed level is not necessarily the event peak.",
        "Observation timezone and ambiguous station metadata fields remain unresolved."
      ],
      "rights": {
        "attribution": [
          "Hydro-Informatics Institute (HII)"
        ],
        "license": "CC Attribution Non-Commercial; version unresolved",
        "public_derivatives": false,
        "status": "local_context_public_derivatives_unresolved"
      },
      "role": "event_observation",
      "source_urls": [
        "https://data.go.th/th/dataset/water-level",
        "https://gdcatalog.go.th/dataset/gdpublish-water-level",
        "https://tiservice.hii.or.th/opendata/data_catalog/water_level/2024/202409/ATG052.csv",
        "https://tiservice.hii.or.th/opendata/data_catalog/water_level/2024/202409/ATG081.csv",
        "https://tiservice.hii.or.th/opendata/data_catalog/water_level/2024/202409/ATG082.csv",
        "https://tiservice.hii.or.th/opendata/data_catalog/water_level/2024/202409/ATG091.csv",
        "https://tiservice.hii.or.th/opendata/data_catalog/water_level/2024/202409/ATG092.csv",
        "https://tiservice.hii.or.th/opendata/data_catalog/water_level/2024/202409/ATG101.csv",
        "https://tiservice.hii.or.th/opendata/data_catalog/water_level/2024/202409/ATG171.csv",
        "https://tiservice.hii.or.th/opendata/data_catalog/water_level/2024/202409/HDA001.csv",
        "https://tiservice.hii.or.th/opendata/data_catalog/water_level/2024/202409/HDA003.csv",
        "https://tiservice.hii.or.th/opendata/data_catalog/water_level/2024/202409/HDA004.csv",
        "https://tiservice.hii.or.th/opendata/data_catalog/water_level/2024/202409/HDA005.csv",
        "https://tiservice.hii.or.th/opendata/data_catalog/water_level/2024/202410/ATG052.csv",
        "https://tiservice.hii.or.th/opendata/data_catalog/water_level/2024/202410/ATG081.csv",
        "https://tiservice.hii.or.th/opendata/data_catalog/water_level/2024/202410/ATG082.csv",
        "https://tiservice.hii.or.th/opendata/data_catalog/water_level/2024/202410/ATG091.csv",
        "https://tiservice.hii.or.th/opendata/data_catalog/water_level/2024/202410/ATG092.csv",
        "https://tiservice.hii.or.th/opendata/data_catalog/water_level/2024/202410/ATG101.csv",
        "https://tiservice.hii.or.th/opendata/data_catalog/water_level/2024/202410/ATG171.csv",
        "https://tiservice.hii.or.th/opendata/data_catalog/water_level/2024/202410/HDA001.csv",
        "https://tiservice.hii.or.th/opendata/data_catalog/water_level/2024/202410/HDA003.csv",
        "https://tiservice.hii.or.th/opendata/data_catalog/water_level/2024/202410/HDA004.csv",
        "https://tiservice.hii.or.th/opendata/data_catalog/water_level/2024/202410/HDA005.csv",
        "https://tiservice.hii.or.th/opendata/data_catalog/water_level/2024/202411/ATG052.csv",
        "https://tiservice.hii.or.th/opendata/data_catalog/water_level/2024/202411/ATG081.csv",
        "https://tiservice.hii.or.th/opendata/data_catalog/water_level/2024/202411/ATG082.csv",
        "https://tiservice.hii.or.th/opendata/data_catalog/water_level/2024/202411/ATG091.csv",
        "https://tiservice.hii.or.th/opendata/data_catalog/water_level/2024/202411/ATG092.csv",
        "https://tiservice.hii.or.th/opendata/data_catalog/water_level/2024/202411/ATG101.csv",